<?xml version="1.0" encoding="UTF-8"?>
<?xmlns = "http://www.ASRS.com" xmlns:xs="http://www.w3.org/2001/XMLSchema-instance" xs:schemaLocation="login.xsd"?>
<login>
	<utente>
		<username>frossi</username>
		<email>frossi@gmail.com</email>
		<password>fabiorossi</password>
		<nome>Fabio</nome>
		<cognome>Rossi</cognome>
		<indirizzo>
			<via>via uruguay</via>
			<numero>10</numero>
			<paese>Italia</paese>
			<provincia>Vicenza</provincia>
		</indirizzo>
		<fatturazione>GMTLKS45862DF89S</fatturazione>
        <tipo_fatt>p.iva</tipo_fatt>
        <admin>no</admin>
	</utente>		
	<utente>
		<username>francesco10</username>
		<email>francesco.p@gmail.com</email>
		<password>francesco18</password>
		<nome>Prancesco</nome>
		<cognome>Palermo</cognome>
		<indirizzo>
			<via>Via Marin</via>
			<numero>57</numero>
			<paese>Italia</paese>
			<provincia>Padova</provincia>
		</indirizzo>
		<fatturazione>GNTMTT91M705S</fatturazione>
		<tipo_fatt>cod.fiscale</tipo_fatt>
		<admin>no</admin>
	</utente>
	<utente>
		<username>admin1</username>
		<email>amministrazione@arsr.com</email>
		<password>amministratore1</password>
		<nome>Francesco</nome>
		<cognome>Agostini</cognome>
		<indirizzo>
			<via>via Roma</via>
			<numero>75</numero>
			<paese>Italia</paese>
			<provincia>Padova</provincia>
		</indirizzo>
		<admin>si</admin>
	</utente>
		
	<utente>
		<username>alessiaT</username>
		<email>alessia_tomba@hotmail.com</email>
		<password>alessia92</password>
		<nome>Alessia</nome>
		<cognome>Tomba</cognome>
		<indirizzo>
			<via>via XX settembre</via>
			<numero>1</numero>
			<paese>Italia</paese>
			<provincia>Verona</provincia>
		</indirizzo>
		<admin>no</admin>
	</utente>	
</login>
